{
  "schemaVersion": "1.0.0",
  "runId": "run-20260820-gemini-pilot-57slots",
  "model": "gemini-2.5-flash",
  "modelVersion": "2026-08-20",
  "createdAt": "2026-08-20T14:15:00Z",
  "taskType": "warehouse_slot_annotation",
  "recordId": "r-msvzlpww-1rqtl3",
  "screenshotRef": "assets/settlement_frames/sec_488.jpg",
  "imageMetadata": {
    "width": 1920,
    "height": 1080,
    "warehouseBbox": [
      1400,
      240,
      1860,
      700
    ]
  },
  "usedConstraints": {
    "actualTotal": false,
    "q": false,
    "count": false,
    "grid": false,
    "knownItems": false
  },
  "annotations": [
    {
      "slotId": "REP-01_s01",
      "bbox": [
        1408,
        256,
        1536,
        384
      ],
      "topK": [
        {
          "itemId": "red_jiugexiaoshi",
          "name": "九格小食",
          "quality": "red",
          "confidence": 0.95
        },
        {
          "itemId": "red_yicuyouhuo",
          "name": "yicuyouhuo",
          "quality": "red",
          "confidence": 0.5
        },
        {
          "itemId": "gold_dabing",
          "name": "dabing",
          "quality": "gold",
          "confidence": 0.5
        }
      ],
      "predictedQuality": "red",
      "source": "gemini-2.5-flash",
      "status": "review_required",
      "provenance": "model-derived_from_reference_matching",
      "failureReason": null
    },
    {
      "slotId": "REP-01_s02",
      "bbox": [
        1744,
        256,
        1872,
        448
      ],
      "topK": [
        {
          "itemId": "gold_wanyouxingyi",
          "name": "万有星仪",
          "quality": "gold",
          "confidence": 0.95
        },
        {
          "itemId": "gold_qiaowangnijindiaoxiang",
          "name": "qiaowangnijindiaoxiang",
          "quality": "gold",
          "confidence": 0.5
        },
        {
          "itemId": "purple_arespaobuji",
          "name": "arespaobuji",
          "quality": "purple",
          "confidence": 0.5
        }
      ],
      "predictedQuality": "gold",
      "source": "gemini-2.5-flash",
      "status": "pseudo",
      "provenance": "model-derived_from_reference_matching",
      "failureReason": null
    },
    {
      "slotId": "REP-01_s03",
      "bbox": [
        1744,
        480,
        1872,
        608
      ],
      "topK": [
        {
          "itemId": "red_xinlietieqi_l3",
          "name": "心猎铁骑L3",
          "quality": "red",
          "confidence": 0.95
        },
        {
          "itemId": "red_xinlietieqi_l2",
          "name": "xinlietieqi_l2",
          "quality": "red",
          "confidence": 0.5
        },
        {
          "itemId": "purple_xinlietieqi_l1",
          "name": "xinlietieqi_l1",
          "quality": "purple",
          "confidence": 0.5
        }
      ],
      "predictedQuality": "red",
      "source": "gemini-2.5-flash",
      "status": "review_required",
      "provenance": "model-derived_from_reference_matching",
      "failureReason": null
    },
    {
      "slotId": "REP-01_s04",
      "bbox": [
        1600,
        448,
        1728,
        576
      ],
      "topK": [
        {
          "itemId": "purple_slime_mud",
          "name": "史莱姆随心泥",
          "quality": "purple",
          "confidence": 0.95
        },
        {
          "itemId": "gold_guanzhuangsuixinni",
          "name": "guanzhuangsuixinni",
          "quality": "gold",
          "confidence": 0.5
        },
        {
          "itemId": "purple_lvdongdanche",
          "name": "lvdongdanche",
          "quality": "purple",
          "confidence": 0.5
        }
      ],
      "predictedQuality": "purple",
      "source": "gemini-2.5-flash",
      "status": "pseudo",
      "provenance": "model-derived_from_reference_matching",
      "failureReason": null
    },
    {
      "slotId": "REP-01_s05",
      "bbox": [
        1424,
        384,
        1552,
        512
      ],
      "topK": [
        {
          "itemId": "blue_yishuhua_shenlin",
          "name": "艺术画「深林」",
          "quality": "blue",
          "confidence": 0.95
        },
        {
          "itemId": "blue_yishuhua_haian",
          "name": "yishuhua_haian",
          "quality": "blue",
          "confidence": 0.5
        },
        {
          "itemId": "white_pailidexiangkuang",
          "name": "pailidexiangkuang",
          "quality": "white",
          "confidence": 0.5
        }
      ],
      "predictedQuality": "blue",
      "source": "gemini-2.5-flash",
      "status": "pseudo",
      "provenance": "model-derived_from_reference_matching",
      "failureReason": null
    },
    {
      "slotId": "REP-01_s06",
      "bbox": [
        1664,
        288,
        1728,
        416
      ],
      "topK": [
        {
          "itemId": "purple_hongyaoshui",
          "name": "红药水",
          "quality": "purple",
          "confidence": 0.7
        },
        {
          "itemId": "purple_chengjieweijiu",
          "name": "chengjieweijiu",
          "quality": "purple",
          "confidence": 0.5
        },
        {
          "itemId": "red_xiahongzuan",
          "name": "xiahongzuan",
          "quality": "red",
          "confidence": 0.5
        }
      ],
      "predictedQuality": "purple",
      "source": "gemini-2.5-flash",
      "status": "review_required",
      "provenance": "model-derived_from_reference_matching",
      "failureReason": null
    },
    {
      "slotId": "REP-01_s07",
      "bbox": [
        1632,
        576,
        1696,
        672
      ],
      "topK": [
        {
          "itemId": "blue_zhinengshouji",
          "name": "智能手机",
          "quality": "blue",
          "confidence": 0.95
        },
        {
          "itemId": "blue_zhinengchongdianqi",
          "name": "zhinengchongdianqi",
          "quality": "blue",
          "confidence": 0.5
        },
        {
          "itemId": "white_dianyingkaquan",
          "name": "dianyingkaquan",
          "quality": "white",
          "confidence": 0.5
        }
      ],
      "predictedQuality": "blue",
      "source": "gemini-2.5-flash",
      "status": "pseudo",
      "provenance": "model-derived_from_reference_matching",
      "failureReason": null
    },
    {
      "slotId": "REP-01_s08",
      "bbox": [
        1776,
        448,
        1840,
        512
      ],
      "topK": [
        {
          "itemId": "purple_xiahongzuan",
          "name": "霞红钻",
          "quality": "purple",
          "confidence": 0.95
        },
        {
          "itemId": "red_chixinshuidi",
          "name": "chixinshuidi",
          "quality": "red",
          "confidence": 0.5
        },
        {
          "itemId": "purple_youlingtai",
          "name": "youlingtai",
          "quality": "purple",
          "confidence": 0.5
        }
      ],
      "predictedQuality": "purple",
      "source": "gemini-2.5-flash",
      "status": "pseudo",
      "provenance": "model-derived_from_reference_matching",
      "failureReason": null
    },
    {
      "slotId": "REP-01_s09",
      "bbox": [
        1440,
        528,
        1504,
        576
      ],
      "topK": [
        {
          "itemId": "white_dianyingkaquan",
          "name": "电影卡券",
          "quality": "white",
          "confidence": 0.7
        },
        {
          "itemId": "blue_zhinengshouji",
          "name": "zhinengshouji",
          "quality": "blue",
          "confidence": 0.5
        },
        {
          "itemId": "white_zhezhibaozhi",
          "name": "zhezhibaozhi",
          "quality": "white",
          "confidence": 0.5
        }
      ],
      "predictedQuality": "white",
      "source": "gemini-2.5-flash",
      "status": "review_required",
      "provenance": "model-derived_from_reference_matching",
      "failureReason": null
    },
    {
      "slotId": "REP-01_s10",
      "bbox": [
        1408,
        496,
        1472,
        592
      ],
      "topK": [
        {
          "itemId": "purple_liushengjiangbei",
          "name": "留声奖杯",
          "quality": "purple",
          "confidence": 0.95
        },
        {
          "itemId": "purple_liushengjiangzuo",
          "name": "liushengjiangzuo",
          "quality": "purple",
          "confidence": 0.5
        },
        {
          "itemId": "gold_jinwan",
          "name": "jinwan",
          "quality": "gold",
          "confidence": 0.5
        }
      ],
      "predictedQuality": "purple",
      "source": "gemini-2.5-flash",
      "status": "pseudo",
      "provenance": "model-derived_from_reference_matching",
      "failureReason": null
    },
    {
      "slotId": "REP-01_s11",
      "bbox": [
        1728,
        560,
        1792,
        624
      ],
      "topK": [
        {
          "itemId": "gold_jinwan",
          "name": "金碗",
          "quality": "gold",
          "confidence": 0.7
        },
        {
          "itemId": "white_huadiaowan",
          "name": "huadiaowan",
          "quality": "white",
          "confidence": 0.5
        },
        {
          "itemId": "gold_liushengjilaba",
          "name": "liushengjilaba",
          "quality": "gold",
          "confidence": 0.5
        }
      ],
      "predictedQuality": "gold",
      "source": "gemini-2.5-flash",
      "status": "review_required",
      "provenance": "model-derived_from_reference_matching",
      "failureReason": null
    },
    {
      "slotId": "REP-01_s12",
      "bbox": [
        1744,
        608,
        1808,
        672
      ],
      "topK": [
        {
          "itemId": "white_caomeiruantang",
          "name": "草莓软糖",
          "quality": "white",
          "confidence": 0.7
        },
        {
          "itemId": "white_caomeitangguo",
          "name": "caomeitangguo",
          "quality": "white",
          "confidence": 0.5
        },
        {
          "itemId": "purple_yuebaisha",
          "name": "yuebaisha",
          "quality": "purple",
          "confidence": 0.5
        }
      ],
      "predictedQuality": "white",